Company Name,HQ Location,Industry Segment,Revenue Bracket (Cr),Founder Technical Background,Growth Signals,Federer Score
Avra Synthesis Pvt Ltd,Hyderabad,Custom Organic Synthesis,50-100 Cr,Founded by Dr. A.V. Rama Rao (Ex-Director of CSIR-IICT),Expanding global CDMO partnerships for specialized fine chemicals,98
Gennova Biopharmaceuticals,Pune,Biologics & mRNA Platforms,200-400 Cr,Led by Dr. Sanjay Singh (PhD in Biochemistry),First indigenous mRNA vaccine platform development in India,96
Divgi TorqTransfer Systems,Pune,Precision Automotive Drivetrains,200-300 Cr,Founded by core automotive system engineers,Beneficiary of India's Auto PLI scheme for EV systems,95
Synergene Active Ingredients,Hyderabad,Complex API Manufacturing,100-200 Cr,Chemical Engineers & Pharma Chemists on board,USFDA and WHO-GMP clearance with active DMF filings,13
Innovassynth Technologies Ltd,Khopoli/Pune,Custom Synthesis & CDMO,150-200 Cr,PhD-heavy industrial research management,Allocated 20 Cr greenfield capex for CRAMS expansion,92
Epitome Components Ltd,Pune,High-Density PCB Manufacturing,150-250 Cr,Founded by electronics manufacturing specialists,Upgraded production infrastructure via electronics components PLI,92
Fermenta Biotech Ltd,Thane/Pune Belt,Niche Enzyme Synthesis,300-450 Cr,Specialized biochemistry research leadership,Global market leadership in Vitamin D3 active ingredients,91
Gears and Gear Drives India,Pune Region,Precision Actuators & Custom Gears,50-100 Cr,Founded by BTech/MTech mechanical engineers,Tier-2 domestic sourcing partner for defense and aerospace,91
Accurate Gauges Pvt Ltd,Pune,Coordinate Measuring Machines,50-100 Cr,Founded by Metrology instrumentation engineers,Integration of automated IoT inspection modules for smart factories,90
Pragati Automation Pvt Ltd,Industrial Belt Supply,Tool Turrets & ATC Systems,150-250 Cr,Machine tool design engineering pioneers,High volume precision engineering export footprints to Europe,90
Maithri Drugs Pvt Ltd,Hyderabad,Custom Synthesis & Advanced APIs,250-400 Cr,Founded by pharmaceutical research scientists,High environmental and regulatory compliance framework expansion,90
Menon Pistons Ltd,Kolhapur/Pune Hub,Precision Auto Components,150-250 Cr,Heavy mechanical engineering management,Direct export volume growth to North American and European OEMs,89
Enaltec Labs Pvt Ltd,Mumbai/Pune Belt,Niche APIs & Custom Synthesis,150-250 Cr,Founded by chemical synthesis research specialists,Regular DMF filings in highly regulated Western markets,89
Chembond Chemicals Ltd,Mumbai/Pune Belt,Water Treatment Specialty Chemicals,150-250 Cr,Chemical engineering family management,Inaugurated a state-of-the-art R&D application lab in Pune,89
Indian Immunologicals Ltd,Hyderabad,Veterinary & Human Biologics,300-500 Cr,Animal science and biotechnology specialists,Secured massive public health tender production contracts,89
Hyma Synthesis Pvt Ltd,Hyderabad,Synthetic Organic Chemicals,50-100 Cr,Technical Managing Directors with chemistry backgrounds,Recent capacity expansion logs filed with state pollution board,88
Lee Pharma Ltd,Hyderabad,Regulated & Semi-Regulated APIs,200-400 Cr,Technical scientific board and pharma specialists,Commissioning new automated pilot scale-up production lines,88
Mechano-Plast Precision,Pune,Custom Injection Molded Engineering,50-100 Cr,Polymer science and tooling engineers,Signed long-term EV lightweighting component contracts with OEMs,88
PMT Machines Ltd,Pune,Precision Machine Tools & CNC,100-200 Cr,Engineering-first leadership core,High-precision structural component contracts for domestic heavy industry,87
Vasudha Pharma Chem,Hyderabad,Piperidone Derivatives & APIs,300-500 Cr,Technical pharma background founders,Massive vertical integration play minimizing raw material dependencies,87
Valiant Organics,Mumbai/Pune Hub,Chlorination & Ammonolysis Chemistry,400-500 Cr,Chemical technologists from elite Indian institutes,Highly specialized downstream derivative manufacturing vertical,87
Paranjape Autocast Pvt Ltd,Pune,Patternless & Precision Castings,200-400 Cr,Metallurgical engineering core team,ISO 14001 certified with tier-1 global automotive clearances,86
Unichem Chemical Intermediates,Pune Region,Specialty Fluorochemicals,50-100 Cr,Industrial chemistry specialists,High-margin import substitution profiles for specialty inputs,86
Celestial Biolabs,Hyderabad,Biotech & Industrial Enzymes,50-100 Cr,Bioinformatics and fermentation pioneers,New patent applications filed for proprietary biocatalysts,85
Sujay Biotech Pvt Ltd,Hyderabad,Agricultural Biotechnology,50-100 Cr,Plant genetics research scientists,Expansion of bio-fertilizer manufacturing lines across western India,84
